{
  "schemaVersion": "plan.v1",
  "delta": {
    "packageName": "P2",
    "ecosystem": "nuget",
    "changeType": "updated",
    "oldVersion": "1.0.0",
    "newVersion": "1.1.0"
  },
  "repos": [
    {
      "repo": "R1",
      "classification": "affected",
      "reasons": [
        "produces P2 (delta target); also consumes P11 produced by R5 — participant in release cycle CYC-1"
      ],
      "ownership": "self",
      "actionType": "unknown",
      "evidenceKinds": [
        "package-evidence.v0",
        "producer-evidence.v0"
      ],
      "confidence": {
        "rung": "declared",
        "corroboration": 1
      }
    },
    {
      "repo": "R5",
      "classification": "affected",
      "reasons": [
        "consumes P2 and produces P11 consumed by R1 — participant in release cycle CYC-1"
      ],
      "ownership": "self",
      "actionType": "unknown",
      "evidenceKinds": [
        "package-evidence.v0",
        "producer-evidence.v0"
      ],
      "confidence": {
        "rung": "declared",
        "corroboration": 1
      }
    }
  ],
  "waves": [],
  "stop": {
    "reason": "CYCLE_DETECTED",
    "detail": "repo-level release cycle detected: R1 produces P2 consumed by R5, while R5 produces P11 consumed by R1. V0 detects and refuses: no wave order is emitted. Bootstrap/intermediate-version resolution is a human-reviewed decision (SPEC-003).",
    "cyclePath": [
      "R1",
      "P2",
      "R5",
      "P11",
      "R1"
    ]
  },
  "uncertainty": {
    "contradictions": [],
    "gaps": []
  }
}
