{
  "schemaVersion": "plan.v1",
  "delta": {
    "packageName": "Bogus.Pin",
    "ecosystem": "nuget",
    "changeType": "updated",
    "oldVersion": "1.0.0",
    "newVersion": "2.0.0"
  },
  "repos": [
    {
      "repo": "vendor",
      "classification": "affected",
      "reasons": [
        "produces Bogus.Pin (delta target) via producer-evidence.v0",
        "ownership.v0 declares vendor = team-b (external to team-a): rendered as coordination, NOT executable work for our team"
      ],
      "ownership": "external",
      "actionType": "external-request-await",
      "evidenceKinds": [
        "producer-evidence.v0",
        "ownership.v0"
      ],
      "confidence": {
        "rung": "fixture-declared",
        "corroboration": 1
      }
    },
    {
      "repo": "R1",
      "classification": "affected",
      "reasons": [
        "direct reference to Bogus.Pin (src/App.csproj)"
      ],
      "ownership": "self",
      "actionType": "executable",
      "evidenceKinds": [
        "package-evidence.v0"
      ],
      "confidence": {
        "rung": "declared",
        "corroboration": 1
      }
    }
  ],
  "waves": [
    {
      "index": 1,
      "status": "conditional",
      "condition": "external team-b releases Bogus.Pin >= 2.0.0 (request/await — outside our change authority; escalation path is the coordination step, not a PR)",
      "prerequisites": [
        "Bogus.Pin >= 2.0.0 available and restorable from the consumer environment (stated, not verified live)"
      ],
      "releaseUnits": [
        {
          "repo": "vendor",
          "packages": [
            "Bogus.Pin"
          ],
          "basis": "assumed-same-repo",
          "notes": [
            "external — request/await"
          ]
        }
      ]
    },
    {
      "index": 2,
      "status": "conditional",
      "condition": "external team-b releases Bogus.Pin >= 2.0.0 (request/await — outside our change authority; escalation path is the coordination step, not a PR)",
      "prerequisites": [
        "Bogus.Pin >= 2.0.0 available and restorable from the consumer environment (stated, not verified live)"
      ],
      "releaseUnits": [
        {
          "repo": "R1",
          "packages": [],
          "basis": "assumed-same-repo"
        }
      ]
    }
  ],
  "uncertainty": {
    "contradictions": [],
    "gaps": []
  }
}
