{
  "schemaVersion": "plan.v1",
  "delta": {
    "packageName": "Bogus.Pin",
    "ecosystem": "nuget",
    "changeType": "updated",
    "oldVersion": "1.0.0",
    "newVersion": "2.0.0"
  },
  "repos": [
    {
      "repo": "teamX",
      "classification": "affected",
      "reasons": [
        "producer claim for Bogus.Pin (claim A of contradiction C1) — BOTH claims retained; neither outranks the other for scheduling"
      ],
      "ownership": "self",
      "actionType": "unknown",
      "evidenceKinds": [
        "producer-evidence.v0"
      ],
      "confidence": {
        "rung": "fixture-declared",
        "corroboration": 1
      }
    },
    {
      "repo": "teamY",
      "classification": "affected",
      "reasons": [
        "producer claim for Bogus.Pin (claim B of contradiction C1) — BOTH claims retained"
      ],
      "ownership": "self",
      "actionType": "unknown",
      "evidenceKinds": [
        "producer-evidence.v0"
      ],
      "confidence": {
        "rung": "fixture-declared",
        "corroboration": 1
      }
    },
    {
      "repo": "R1",
      "classification": "affected",
      "reasons": [
        "direct reference to Bogus.Pin (src/App.csproj)",
        "downstream of a CONTRADICTED producer — appears only in a provisional wave blocked on C1; no firm prerequisite on either claim"
      ],
      "ownership": "self",
      "actionType": "unknown",
      "evidenceKinds": [
        "package-evidence.v0"
      ],
      "confidence": {
        "rung": "declared",
        "corroboration": 1
      }
    }
  ],
  "waves": [
    {
      "index": 1,
      "status": "provisional",
      "blockedOn": "C1",
      "prerequisites": [],
      "releaseUnits": [
        {
          "repo": "teamX",
          "packages": [
            "Bogus.Pin"
          ],
          "basis": "assumed-same-repo",
          "notes": [
            "candidate producer — provisional pending C1 resolution"
          ]
        },
        {
          "repo": "teamY",
          "packages": [
            "Bogus.Pin"
          ],
          "basis": "assumed-same-repo",
          "notes": [
            "candidate producer — provisional pending C1 resolution"
          ]
        }
      ]
    },
    {
      "index": 2,
      "status": "provisional",
      "blockedOn": "C1",
      "prerequisites": [
        "C1 resolved: authoritative producer of Bogus.Pin determined by human decision; then Bogus.Pin 2.0.0 published (stated, not verified live)"
      ],
      "releaseUnits": [
        {
          "repo": "R1",
          "packages": [],
          "basis": "assumed-same-repo"
        }
      ]
    }
  ],
  "uncertainty": {
    "contradictions": [
      {
        "id": "C1",
        "subject": "Bogus.Pin producer",
        "claims": [
          {
            "repo": "teamX",
            "packageId": "Bogus.Pin"
          },
          {
            "repo": "teamY",
            "packageId": "Bogus.Pin"
          }
        ],
        "downstreamProvisional": [
          "R1"
        ]
      }
    ],
    "gaps": []
  }
}
