{
  "schemaVersion": "plan.v1",
  "delta": {
    "packageName": "N1",
    "ecosystem": "nuget",
    "changeType": "updated",
    "oldVersion": "3.0.0",
    "newVersion": "3.0.1"
  },
  "repos": [
    {
      "repo": "R1",
      "classification": "affected",
      "reasons": [
        "direct reference to N1 (R1/src/Lib.csproj); produces P1 — bump + republish flows the update",
        "N1 attribution: DECLARED external via producer-evidence.v0 externalPackages (evidence-backed, not inferred from producer absence — absence alone means unknown, per F3a)"
      ],
      "ownership": "self",
      "actionType": "executable",
      "evidenceKinds": [
        "package-evidence.v0",
        "producer-evidence.v0"
      ],
      "confidence": {
        "rung": "declared",
        "corroboration": 1
      }
    },
    {
      "repo": "R2",
      "classification": "affected",
      "reasons": [
        "transitive path R2 -> P1 -> N1 evidenced by R2's lockfile rows (N1 transitive via P1)"
      ],
      "ownership": "self",
      "actionType": "executable",
      "evidenceKinds": [
        "package-evidence.v0",
        "lockfile-rows.v0"
      ],
      "confidence": {
        "rung": "declared",
        "corroboration": 1
      }
    }
  ],
  "waves": [
    {
      "index": 1,
      "status": "ready",
      "prerequisites": [
        "N1 3.0.1 available from the public feed (N1 declared external via producer-evidence.v0; stated, not verified live)"
      ],
      "releaseUnits": [
        {
          "repo": "R1",
          "packages": [
            "P1"
          ],
          "basis": "assumed-same-repo"
        }
      ]
    },
    {
      "index": 2,
      "status": "ready",
      "prerequisites": [
        "R1 publishes P1 rebuilt against N1 3.0.1 (stated, not verified live)"
      ],
      "releaseUnits": [
        {
          "repo": "R2",
          "packages": [],
          "basis": "assumed-same-repo"
        }
      ]
    }
  ],
  "uncertainty": {
    "contradictions": [],
    "gaps": [
      {
        "subject": "N1 producer",
        "detail": "N1 is declared external via producer-evidence.v0 externalPackages — attribution is evidence-backed; no scanner/advisory input is claimed (V0 does not ingest scanners)"
      }
    ]
  }
}
