{
  "schemaVersion": "plan.v1",
  "delta": {
    "packageName": "Newtonsoft.Json",
    "ecosystem": "nuget",
    "changeType": "updated",
    "oldVersion": "12.0.3",
    "newVersion": "13.0.3"
  },
  "repos": [
    {
      "repo": "billing",
      "classification": "affected",
      "reasons": [
        "transitive path billing -> Contoso.Payments -> Newtonsoft.Json evidenced by billing's lockfile rows (Newtonsoft.Json transitive via Contoso.Payments)"
      ],
      "ownership": "self",
      "actionType": "executable",
      "evidenceKinds": [
        "package-evidence.v0",
        "lockfile-rows.v2"
      ],
      "confidence": {
        "rung": "declared",
        "corroboration": 1
      },
      "scanNotes": [
        "Compiler diagnostic category: CompilerDiagnostic. Native output was redacted.",
        "analysisLevel: Level1SemanticAnalysisReduced",
        "scan buildStatus: FailedOrPartial"
      ]
    },
    {
      "repo": "shipping",
      "classification": "affected",
      "reasons": [
        "transitive path shipping -> Contoso.Payments -> Newtonsoft.Json evidenced by shipping's lockfile rows (Newtonsoft.Json transitive via Contoso.Payments)"
      ],
      "ownership": "self",
      "actionType": "executable",
      "evidenceKinds": [
        "package-evidence.v0",
        "lockfile-rows.v2"
      ],
      "confidence": {
        "rung": "declared",
        "corroboration": 1
      },
      "scanNotes": [
        "Compiler diagnostic category: CompilerDiagnostic. Native output was redacted.",
        "analysisLevel: Level1SemanticAnalysisReduced",
        "scan buildStatus: FailedOrPartial"
      ]
    },
    {
      "repo": "svc",
      "classification": "affected",
      "reasons": [
        "transitive path svc -> Contoso.Core -> Newtonsoft.Json evidenced by svc's lockfile rows (Newtonsoft.Json transitive via Contoso.Core)",
        "repo ABSENT from ownership.v0 — ownership unknown, never assumed ours; coordination target unidentified, so no executable action is scheduled"
      ],
      "ownership": "unknown",
      "actionType": "unknown",
      "evidenceKinds": [
        "package-evidence.v0",
        "lockfile-rows.v2"
      ],
      "confidence": {
        "rung": "declared",
        "corroboration": 1
      },
      "scanNotes": [
        "Compiler diagnostic category: CompilerDiagnostic. Native output was redacted.",
        "Workspace diagnostic category: SdkResolutionFailed. Native output was redacted.",
        "Workspace diagnostic category: UncategorizedWorkspaceFailure. Native output was redacted.",
        "analysisLevel: Level1SemanticAnalysisReduced",
        "scan buildStatus: FailedOrPartial"
      ]
    },
    {
      "repo": "cleanrepo",
      "classification": "unknown",
      "reasons": [
        "classification unknown: coverage gaps or unresolved exposure — never not-affected without positive evidence"
      ],
      "ownership": "unknown",
      "actionType": "unknown",
      "evidenceKinds": [
        "package-evidence.v0"
      ],
      "confidence": {
        "rung": "declared",
        "corroboration": 1
      }
    }
  ],
  "waves": [
    {
      "index": 1,
      "status": "ready",
      "prerequisites": [
        "Newtonsoft.Json 13.0.3 available from the public feed (Newtonsoft.Json declared external via producer-evidence.v0; stated, not verified live)"
      ],
      "releaseUnits": [
        {
          "repo": "billing",
          "packages": [],
          "basis": "assumed-same-repo"
        },
        {
          "repo": "shipping",
          "packages": [],
          "basis": "assumed-same-repo"
        }
      ]
    }
  ],
  "uncertainty": {
    "contradictions": [],
    "gaps": [
      {
        "subject": "Newtonsoft.Json producer",
        "detail": "Newtonsoft.Json is declared external via producer-evidence.v0 externalPackages — attribution is evidence-backed; no scanner/advisory input is claimed (V0 does not ingest scanners)"
      },
      {
        "subject": "svc coverage (lockfile-evidenced)",
        "detail": "scan gaps on NuGet lockfile analysis reported `packages-lock-group-unsupported`. — svc is affected via lockfile-evidenced transitive exposure; the gaps qualify how much additional work is unknown, they do not erase the evidenced exposure"
      },
      {
        "subject": "svc ownership",
        "detail": "svc absent from ownership.v0 — ownership unknown (never 'ours'); svc is NOT scheduled into a wave until ownership is established"
      }
    ],
    "findings": [
      {
        "subject": "svc version disagreement: Contoso.Core",
        "detail": "svc resolves Contoso.Core to 2 versions across its lockfile/TFM resolution groups: 1.0.0 in src/Api/packages.lock.json (net8.0); 0.9.0 in src/Worker/packages.lock.json (net8.0) — evidenced disagreement, not an error; V0 schedules svc once at unit level and picks no winner (convergence is deliberately out of scope, §10); svc also has lockfile groups the scanner could not parse and contributed no rows — those resolutions stay unevidenced (coverage gap)"
      },
      {
        "subject": "svc version disagreement: Newtonsoft.Json",
        "detail": "svc resolves Newtonsoft.Json to 2 versions across its lockfile/TFM resolution groups: 13.0.1 in src/Api/packages.lock.json (net8.0); 12.0.3 in src/Worker/packages.lock.json (net8.0) [delta from-version] — evidenced disagreement, not an error; V0 schedules svc once at unit level and picks no winner (convergence is deliberately out of scope, §10)"
      }
    ]
  }
}
